{
  "schema_version": 2,
  "source": {
    "repository": "TakashiSasaki/templates",
    "revision": "a739b3823660e3db742ff0e1e159d279126cba7c"
  },
  "intent": {
    "recipe": "website",
    "components": {
      "include": [
        "capability.pwa"
      ],
      "exclude": [
        "capability.webmcp"
      ]
    },
    "parameters": {}
  },
  "recipe_sha256": "e48ea5561bf226972048a7f5a0746a06974ab34c657b99e720d6330f0c0a7d66",
  "configuration_sha256": "68c61762f2a2bf9f1bc0efde391ec43766aa8f8f253b59f86f3cd634266e7159",
  "resolved_components": [
    {
      "id": "artifact.website-core",
      "version": 1,
      "descriptor_sha256": "a053df53314b3e7f58fee7a292a9ffa806648775c36f04641ecad10fd8a56d8a"
    },
    {
      "id": "capability.pwa",
      "version": 4,
      "descriptor_sha256": "6b653bb134e633e51d9fda455de82e6e2d26db0079c49b791f4e65935ce479e2"
    },
    {
      "id": "foundation.web",
      "version": 3,
      "descriptor_sha256": "468dcb4d5a98b4717bfdefa7bbc88649fe8490568d56d935f32d8d1f154a066f"
    },
    {
      "id": "lifecycle.composition-state",
      "version": 21,
      "descriptor_sha256": "44652fd7340948614448668f3db53779b7f8c783f14184ddbd58915d2cb50415"
    },
    {
      "id": "lifecycle.contract-evolution",
      "version": 3,
      "descriptor_sha256": "16f8e0f91b321e1002108a253f96c18c47db2927c946458496fb270ca8580b0f"
    },
    {
      "id": "lifecycle.implementation-evidence",
      "version": 14,
      "descriptor_sha256": "a7b12df9e681e3c88d0521fc53191860a3b767fa14569170d7c03b237534c29b"
    },
    {
      "id": "lifecycle.lifecycle-checkpoints",
      "version": 4,
      "descriptor_sha256": "183cc655b7f1ebf26de2dd397900c76392bdce6c3f2116aa0b01619f5f9be3ca"
    }
  ],
  "files": [
    {
      "destination": ".github/workflows/validate-website.yml",
      "component": "artifact.website-core",
      "ownership": "managed",
      "materialized_sha256": "8bfa4d70957d67965bfc0cec2135e1dc8a73ba3fe1f59f4e51a7fbb3b448f496"
    },
    {
      "destination": ".template-composition/checkpoint.py",
      "component": "lifecycle.lifecycle-checkpoints",
      "ownership": "managed",
      "materialized_sha256": "7bec7512e496fabfc4f6d67e341b44213d12ad0fed2e8b486168756e3dabc7ef"
    },
    {
      "destination": ".template-composition/composition-lock.schema.json",
      "component": "lifecycle.composition-state",
      "ownership": "managed",
      "materialized_sha256": "c6a520a4c5e0ef36571ef1a59fa2fc076765a513f422caf7c88c619c8a239297"
    },
    {
      "destination": ".template-composition/implementation-evidence-actions.json",
      "component": "lifecycle.implementation-evidence",
      "ownership": "managed",
      "materialized_sha256": "cbdc930f57077606c6369ec325a1115b127b01fc91eb7e7ba6bfa09c4592f4d7"
    },
    {
      "destination": ".template-composition/implementation-evidence-actions.schema.json",
      "component": "lifecycle.implementation-evidence",
      "ownership": "managed",
      "materialized_sha256": "06d1649c886f05ba4656d40c4ce26cd27f38ead55b6543958887fd86c1086e78"
    },
    {
      "destination": ".template-composition/implementation-evidence-release-readiness.schema.json",
      "component": "lifecycle.implementation-evidence",
      "ownership": "managed",
      "materialized_sha256": "5d3e5cab1c7cb5eda234b49269a3d4513407ba42adf50abb9b5852b049afb332"
    },
    {
      "destination": ".template-composition/lifecycle-checkpoint-action-result.schema.json",
      "component": "lifecycle.lifecycle-checkpoints",
      "ownership": "managed",
      "materialized_sha256": "4b11ed536cebc519af6dbda3e0c2fa800bd43e3e1971128549875d14691eaa17"
    },
    {
      "destination": ".template-composition/lifecycle-checkpoint-actions.json",
      "component": "lifecycle.lifecycle-checkpoints",
      "ownership": "managed",
      "materialized_sha256": "6ff45208373acd40e81a6ba9bbd8c34159d0c41d64d57ada3be621f4dacc3f90"
    },
    {
      "destination": ".template-composition/lifecycle-checkpoint-actions.schema.json",
      "component": "lifecycle.lifecycle-checkpoints",
      "ownership": "managed",
      "materialized_sha256": "5c6340b86166dc49e30b363332e5fdcb51d3c40ed333e400b58b011718292910"
    },
    {
      "destination": ".template-composition/lifecycle-next-actions.schema.json",
      "component": "lifecycle.composition-state",
      "ownership": "managed",
      "materialized_sha256": "65452c91826bf7ceef43b1d0f9071f811d448358c453f21941fc8843f752fb1c"
    },
    {
      "destination": ".template-composition/requirements-validation.lock",
      "component": "lifecycle.contract-evolution",
      "ownership": "managed",
      "materialized_sha256": "4f7abee46e68d6f1072ee7c7439d69c68533e7ce7b063d417c556898938279c5"
    },
    {
      "destination": ".template-composition/run_action.py",
      "component": "lifecycle.composition-state",
      "ownership": "managed",
      "materialized_sha256": "c7439b6cd34a27a73930e52b960173b7394da20e96b8bdbc6d7f987bdfea5928"
    },
    {
      "destination": ".template-composition/validate.py",
      "component": "lifecycle.composition-state",
      "ownership": "managed",
      "materialized_sha256": "204a8c036877f9561be6b3950a8da0a848b6b5fb50656d12dd8e451cc5cdc8b1"
    },
    {
      "destination": ".template-composition/validate_composition.py",
      "component": "lifecycle.composition-state",
      "ownership": "managed",
      "materialized_sha256": "67c5e5b90eb08bc641a4bfe9e4f87a15810fbf7ea06643a08e1cf931947d9947"
    },
    {
      "destination": ".template-composition/validate_impl.py",
      "component": "lifecycle.composition-state",
      "ownership": "managed",
      "materialized_sha256": "ce84681cf27364b45adc5315071c0578254054166ab9ecf045bbd2cb65e77bbf"
    },
    {
      "destination": ".template-composition/validation-registry.json",
      "component": "lifecycle.composition-state",
      "ownership": "managed",
      "materialized_sha256": "96b6aeee60a25a9cde7a11646068491e0519249f41ae28b5b71c0e14c85541bb"
    },
    {
      "destination": ".template-composition/validators/contract_common.py",
      "component": "lifecycle.contract-evolution",
      "ownership": "managed",
      "materialized_sha256": "c71185664a0b4bb9053c557787d55835e78736bc1a5a98919335e23bfdd4d45f"
    },
    {
      "destination": ".template-composition/validators/validate_contract_evolution.py",
      "component": "lifecycle.contract-evolution",
      "ownership": "managed",
      "materialized_sha256": "6b9a95f988970a7be9cac173e66c4910e405240def98e07ec2d4954176b6c34c"
    },
    {
      "destination": ".template-composition/validators/validate_implementation_evidence.py",
      "component": "lifecycle.implementation-evidence",
      "ownership": "managed",
      "materialized_sha256": "13b4df9a87e14dc93af3ac43cfbb08820faa8ad199c48f0954847f17e515a906"
    },
    {
      "destination": ".template-composition/validators/validate_lifecycle_checkpoints.py",
      "component": "lifecycle.lifecycle-checkpoints",
      "ownership": "managed",
      "materialized_sha256": "64244e2cd9bb42f729d31b2e90cddbb23ba91e99ea5194ed7ba9998d657f5a49"
    },
    {
      "destination": ".template-composition/validators/validate_pwa.py",
      "component": "capability.pwa",
      "ownership": "managed",
      "materialized_sha256": "0e5143738d2526bccb60fe327e0ddf97bf623d2416740035626c98f1400d6d3d"
    },
    {
      "destination": ".template-composition/validators/validate_pwa_evidence.py",
      "component": "capability.pwa",
      "ownership": "managed",
      "materialized_sha256": "a32306ef7b7183e30a0f6c725ef10c7cc3e730481d52c227bcf0f70d340f0891"
    },
    {
      "destination": "PWA.md",
      "component": "capability.pwa",
      "ownership": "seed",
      "materialized_sha256": "e7a5e652f96eadbb85f75a515f237a98e878dc5a1b080b81bbeebd934985d985"
    },
    {
      "destination": "contracts/browser-identity.json",
      "component": "foundation.web",
      "ownership": "seed",
      "materialized_sha256": "c56eff611c0736c724f951261f2d9ffdc96527d0e5c97b6ef81a1a4609a44c01"
    },
    {
      "destination": "contracts/document-metadata.json",
      "component": "artifact.website-core",
      "ownership": "seed",
      "materialized_sha256": "db0e9183b7fd7d9049d0622ec01bc82283af8287f154632c15c484c99fb2504d"
    },
    {
      "destination": "contracts/implementation-evidence.json",
      "component": "lifecycle.implementation-evidence",
      "ownership": "seed",
      "materialized_sha256": "b7bbdf550e97ca33261bf5f3c54bd67eec67c598417bb09d0f4ef76e0c6e2f7b"
    },
    {
      "destination": "contracts/lifecycle-checkpoints.json",
      "component": "lifecycle.lifecycle-checkpoints",
      "ownership": "seed",
      "materialized_sha256": "0242cd734b8f0c14e381f5e850dc4ac80e1dd611f9892c912fc0d25a0f39d0a1"
    },
    {
      "destination": "contracts/manifest.json",
      "component": "lifecycle.contract-evolution",
      "ownership": "generated",
      "materialized_sha256": "2bdfb597a7ee661988aa58cfbb8b017b89e0be467984702c1b06144f7300084e"
    },
    {
      "destination": "contracts/pwa-manifest.json",
      "component": "capability.pwa",
      "ownership": "seed",
      "materialized_sha256": "4a3319408fe514122ba098f349683f9e5577a6acfffb9a77cea139ae12fac99e"
    },
    {
      "destination": "contracts/pwa-offline.json",
      "component": "capability.pwa",
      "ownership": "seed",
      "materialized_sha256": "526054318c598d1cbf4fa055acb3889a8ea8f5ba6c97d96fddca0a314cfa44c1"
    },
    {
      "destination": "contracts/pwa-update.json",
      "component": "capability.pwa",
      "ownership": "seed",
      "materialized_sha256": "bb2b79668df807b354e55a49257af56cfcc79e0c9cd1cfe6e17123d427143429"
    },
    {
      "destination": "contracts/routes.json",
      "component": "foundation.web",
      "ownership": "seed",
      "materialized_sha256": "89d101a2105e0f1e48e0c4b87fa0941b1ea32803cd8062b1bef1ba49bad5fe78"
    },
    {
      "destination": "contracts/site-discovery.json",